{
  "pack_id": "2026-02-21__test-keyword__pack_v1",
  "brain": "BD_Brain",
  "keyword": "test keyword",
  "created_at": "2026-02-21T16:03:04.667565+00:00",
  "sources": [
    {
      "source_id": "yt_001",
      "source_type": "youtube",
      "title": "Test Keyword Strategy Breakdown #1",
      "channel": "Mocked Channel",
      "url": "https://youtube.com/watch?v=mock001",
      "published_at": "2026-02-21T16:03:04.654913+00:00",
      "duration_seconds": 600
    },
    {
      "source_id": "yt_002",
      "source_type": "youtube",
      "title": "Test Keyword Strategy Breakdown #2",
      "channel": "Mocked Channel",
      "url": "https://youtube.com/watch?v=mock002",
      "published_at": "2026-02-20T16:03:04.654913+00:00",
      "duration_seconds": 645
    },
    {
      "source_id": "yt_003",
      "source_type": "youtube",
      "title": "Test Keyword Strategy Breakdown #3",
      "channel": "Mocked Channel",
      "url": "https://youtube.com/watch?v=mock003",
      "published_at": "2026-02-19T16:03:04.654913+00:00",
      "duration_seconds": 690
    },
    {
      "source_id": "yt_004",
      "source_type": "youtube",
      "title": "Test Keyword Strategy Breakdown #4",
      "channel": "Mocked Channel",
      "url": "https://youtube.com/watch?v=mock004",
      "published_at": "2026-02-18T16:03:04.654913+00:00",
      "duration_seconds": 735
    },
    {
      "source_id": "yt_005",
      "source_type": "youtube",
      "title": "Test Keyword Strategy Breakdown #5",
      "channel": "Mocked Channel",
      "url": "https://youtube.com/watch?v=mock005",
      "published_at": "2026-02-17T16:03:04.654913+00:00",
      "duration_seconds": 780
    }
  ],
  "outputs": {
    "Brain_Additions.md": "Brain_Additions.md",
    "Brain_Core.jsonl": "Brain_Core.jsonl",
    "Brain_Diff.md": "Brain_Diff.md",
    "Sources.csv": "Sources.csv",
    "Run_Metadata.json": "Run_Metadata.json"
  },
  "stats": {
    "videos_discovered": 5,
    "videos_queued": 5,
    "records_extracted": 5
  }
}